{
  "schema_version": "0.1.0",
  "released_on": "2026-09-17",
  "license": "CC-BY-4.0",
  "phase_vocabulary": [
    "trigger",
    "amplification",
    "transmission",
    "policy",
    "resolution"
  ],
  "mechanism_count": 32,
  "mechanisms": [
    {
      "id": "energy_supply_shock",
      "status": "canonical",
      "introduced_in": "0.1.0",
      "definition_en": "A disruption, or credible risk of disruption, to the physical availability of energy.",
      "definition_tr": "Enerjinin fiziksel olarak bulunabilirliğinde kesinti veya güvenilir kesinti riski.",
      "boundary_en": "Physical supply is central; price pass-through alone belongs under energy_cost_pressure.",
      "boundary_tr": "Merkezde fiziksel arz vardır; yalnız fiyat geçişi energy_cost_pressure altında kodlanır.",
      "default_phase_roles": [
        "trigger"
      ]
    },
    {
      "id": "energy_supply_relief",
      "status": "canonical",
      "introduced_in": "0.1.0",
      "definition_en": "An easing of a previously binding energy-supply constraint or disruption risk.",
      "definition_tr": "Daha önce bağlayıcı olan enerji arz kısıtının veya kesinti riskinin gevşemesi.",
      "boundary_en": "Relief requires easing of the supply constraint, not merely weaker energy demand.",
      "boundary_tr": "Gevşeme arz kısıtında olmalıdır; yalnız enerji talebinin düşmesi yeterli değildir.",
      "default_phase_roles": [
        "resolution",
        "policy"
      ]
    },
    {
      "id": "energy_cost_pressure",
      "status": "canonical",
      "introduced_in": "0.1.0",
      "definition_en": "Pressure transmitted to households, firms, or public balance sheets through the cost of energy.",
      "definition_tr": "Enerji maliyeti üzerinden hane, şirket veya kamu bilançolarına aktarılan baskı.",
      "boundary_en": "This is the cost-transmission channel, not the physical supply disruption itself.",
      "boundary_tr": "Bu maliyet-aktarım kanalıdır; fiziksel arz kesintisinin kendisi değildir.",
      "default_phase_roles": [
        "amplification",
        "trigger"
      ]
    },
    {
      "id": "inflation_pressure",
      "status": "canonical",
      "introduced_in": "0.1.0",
      "definition_en": "Broad forces that push the general price level persistently upward.",
      "definition_tr": "Genel fiyat düzeyini kalıcı biçimde yukarı iten geniş tabanlı güçler.",
      "boundary_en": "This is broader than any single inflation channel; cost_inflation is one possible mechanism beneath it.",
      "boundary_tr": "Tek bir enflasyon kanalından geniştir; cost_inflation bunun altındaki olası mekanizmalardan biridir.",
      "default_phase_roles": [
        "amplification",
        "trigger"
      ]
    },
    {
      "id": "cost_inflation",
      "status": "canonical",
      "introduced_in": "0.1.0",
      "definition_en": "Inflation transmitted primarily through rising input, wage, logistics, or production costs.",
      "definition_tr": "Esas olarak girdi, ücret, lojistik veya üretim maliyetlerindeki artışla taşınan enflasyon.",
      "boundary_en": "The causal cost channel must be present; a high inflation reading alone is insufficient.",
      "boundary_tr": "Nedensel maliyet kanalı bulunmalıdır; yalnız yüksek enflasyon verisi yeterli değildir.",
      "default_phase_roles": [
        "amplification",
        "trigger"
      ]
    },
    {
      "id": "duration_selloff",
      "status": "canonical",
      "introduced_in": "0.1.0",
      "definition_en": "Selling pressure concentrated in long-duration bonds or assets as discount rates or term premia reprice.",
      "definition_tr": "İskonto oranı veya vade primi yeniden fiyatlanırken uzun vadeli tahvil ve varlıklarda yoğunlaşan satış baskısı.",
      "boundary_en": "The duration channel must dominate; this is not a label for every bond-market decline.",
      "boundary_tr": "Süre kanalı baskın olmalıdır; her tahvil piyasası düşüşünün etiketi değildir.",
      "default_phase_roles": [
        "transmission",
        "amplification"
      ]
    },
    {
      "id": "sovereign_funding_stress",
      "status": "canonical",
      "introduced_in": "0.1.0",
      "definition_en": "Strain on a sovereign's capacity or cost to issue, roll over, or service public obligations.",
      "definition_tr": "Devletin kamu yükümlülüklerini ihraç, çevirme veya ödeme kapasitesi ve maliyeti üzerindeki stres.",
      "boundary_en": "The stressed borrower is the sovereign; corporate funding and currency pressure are separate mechanisms.",
      "boundary_tr": "Stres altındaki borçlu egemendir; şirket fonlaması ve kur baskısı ayrı mekanizmalardır.",
      "default_phase_roles": [
        "amplification",
        "transmission"
      ]
    },
    {
      "id": "fx_pressure",
      "status": "canonical",
      "introduced_in": "0.1.0",
      "definition_en": "System-level pressure on an exchange rate or on access to foreign-currency funding.",
      "definition_tr": "Kur üzerinde veya döviz fonlamasına erişimde sistem düzeyinde baskı.",
      "boundary_en": "This is the system-level pressure; entity-specific exposure belongs under currency_sensitivity.",
      "boundary_tr": "Bu sistem düzeyindeki baskıdır; kurum veya sektör maruziyeti currency_sensitivity altında kodlanır.",
      "default_phase_roles": [
        "trigger",
        "transmission"
      ]
    },
    {
      "id": "currency_sensitivity",
      "status": "canonical",
      "introduced_in": "0.1.0",
      "definition_en": "Material exposure of an entity or sector's cash flow, costs, revenues, or balance sheet to exchange-rate changes.",
      "definition_tr": "Bir kurum veya sektörün nakit akışı, maliyet, gelir ya da bilançosunun kur değişimlerine maddi duyarlılığı.",
      "boundary_en": "This is exposure to currency movement, not the system-wide currency pressure itself.",
      "boundary_tr": "Bu kur hareketine maruziyettir; sistem genelindeki kur baskısının kendisi değildir.",
      "default_phase_roles": [
        "amplification"
      ]
    },
    {
      "id": "intervention_risk",
      "status": "canonical",
      "introduced_in": "0.1.0",
      "definition_en": "A credible risk or expectation of official intervention in currency, rates, credit, or commodity markets.",
      "definition_tr": "Kur, faiz, kredi veya emtia piyasalarında resmî müdahaleye ilişkin güvenilir risk ya da beklenti.",
      "boundary_en": "The mechanism is intervention risk or expectation, not every change in the expected policy path.",
      "boundary_tr": "Mekanizma müdahale riski veya beklentisidir; beklenen politika yolundaki her değişim değildir.",
      "default_phase_roles": [
        "policy",
        "trigger",
        "resolution"
      ]
    },
    {
      "id": "liquidity_stress",
      "status": "canonical",
      "introduced_in": "0.1.0",
      "definition_en": "Difficulty obtaining funding or transacting at scale without material delay, discount, or price impact.",
      "definition_tr": "Maddi gecikme, iskonto veya fiyat etkisi olmadan fonlama sağlama ya da büyük işlem yapma güçlüğü.",
      "boundary_en": "Impaired funding or market functioning is required; volatility alone is insufficient.",
      "boundary_tr": "Fonlama veya piyasa işleyişi bozulmalıdır; yalnız oynaklık yeterli değildir.",
      "default_phase_roles": [
        "transmission",
        "amplification"
      ]
    },
    {
      "id": "policy_repricing",
      "status": "canonical",
      "introduced_in": "0.1.0",
      "definition_en": "A material revaluation of the expected path, stance, or reaction function of monetary or fiscal policy.",
      "definition_tr": "Para veya maliye politikasının beklenen yolu, duruşu ya da tepki fonksiyonunun maddi yeniden fiyatlanması.",
      "boundary_en": "The change is in expected policy and its pricing, not merely the announcement of an isolated action.",
      "boundary_tr": "Değişim beklenen politika ve fiyatlamasındadır; tekil bir kararın duyurulmasıyla sınırlı değildir.",
      "default_phase_roles": [
        "policy",
        "trigger"
      ]
    },
    {
      "id": "geopolitical_escalation",
      "status": "canonical",
      "introduced_in": "0.1.0",
      "definition_en": "An intensification of geopolitical conflict or coercion that enters economic behavior, allocation, or pricing.",
      "definition_tr": "Ekonomik davranışa, tahsise veya fiyatlamaya giren jeopolitik çatışma ya da zorlamanın şiddetlenmesi.",
      "boundary_en": "Geopolitical news alone is insufficient; escalation must alter constraints, behavior, or risk pricing.",
      "boundary_tr": "Yalnız jeopolitik haber yeterli değildir; tırmanış kısıtları, davranışı veya risk fiyatlamasını değiştirmelidir.",
      "default_phase_roles": [
        "trigger"
      ]
    },
    {
      "id": "geopolitical_deescalation",
      "status": "canonical",
      "introduced_in": "0.1.0",
      "definition_en": "An easing of geopolitical conflict or coercion that relaxes an economically binding constraint or risk premium.",
      "definition_tr": "Ekonomik olarak bağlayıcı bir kısıtı veya risk primini gevşeten jeopolitik çatışma ya da zorlamanın hafiflemesi.",
      "boundary_en": "De-escalation is an active easing of prior stress, not the simple absence of new escalation.",
      "boundary_tr": "Yumuşama önceki stresin aktif gevşemesidir; yeni tırmanış olmaması tek başına yeterli değildir.",
      "default_phase_roles": [
        "resolution"
      ]
    },
    {
      "id": "commodity_supply_squeeze",
      "status": "canonical",
      "introduced_in": "0.1.0",
      "definition_en": "A tightening of physical commodity availability relative to near-term demand or deliverable capacity.",
      "definition_tr": "Fiziksel emtia bulunabilirliğinin yakın dönem talebe veya teslim kapasitesine göre sıkışması.",
      "boundary_en": "Physical availability or deliverability is central; generalized cost inflation is a downstream mechanism.",